{"as_of_utc":"2026-08-22T00:18:35Z","document_path":"state/checkpoints/20260822T001835Z_workflow-maintenance-and-m4-tokenizer-review.md","document_role":"checkpoint","document_sha256":"5676d59fc630754de00a0796c99c6b452f3f01fa55a41c6afe692d5306029011","owner_role":"WORKFLOW_COORDINATOR","schema_version":"workflow-state-metadata-v1","source_commit":"dad1de511f93226165bb2d572997ac12b6d714bb","status":"current","supersedes_metadata_sha256":[]}
