{"as_of_utc":"2026-08-19T14:51:00Z","document_path":"state/COORDINATOR_HANDOFF_CHECKPOINT.md","document_role":"checkpoint","document_sha256":"4931994822f558750644ab522658eedd447b7765d54b6e7f967397a61ee8f1ef","owner_role":"WORKFLOW_COORDINATOR","schema_version":"workflow-state-metadata-v1","source_commit":"d38f9069d9a4f2a92ffb3a29d6f80ef4e7253da9","status":"historical","supersedes_metadata_sha256":[]}
