{"as_of_utc":"2026-08-22T06:23:05Z","document_path":"docs/rulings/provenance_log.md","document_role":"custody_history","document_sha256":"a4123e9cb315c20c0bc2b237ba1f607057d36ade101a1484ae66a6c34eee25e8","owner_role":"RECORDER","schema_version":"workflow-state-metadata-v1","source_commit":"aa4edfaff72f84f73f122e47348dbc25eaead263","status":"current","supersedes_metadata_sha256":["dbedadf38cfe1e38a618a0a504780e9a6ae49dc3da0d598881d9c54db00a19aa"]}
