{"as_of_utc":"2026-08-21T22:45:00Z","document_path":"state/STATE.md","document_role":"durable_state","document_sha256":"6bd3a15929032bbdb7e332cd7739b31641c05e5967037230f72445aadbd42ac6","owner_role":"INTEGRATOR","schema_version":"workflow-state-metadata-v1","source_commit":"e04589b819946d28fd0ed0ef99a3f40181ba66a2","status":"current","supersedes_metadata_sha256":[]}