{"as_of_utc":"2026-08-21T21:59:03Z","document_path":"state/COORDINATOR_LEDGER.md","document_role":"routing","document_sha256":"051a110026a211e04e44d83e51bfe30573556e129bb966a0353ec3d9d1fb61a0","owner_role":"WORKFLOW_COORDINATOR","schema_version":"workflow-state-metadata-v1","source_commit":"8923112fde4ce95a6dad03f6c71f5235eeccc7e5","status":"current","supersedes_metadata_sha256":[]}
